id,Title,Tag,Year,Rating,Genre,Runtime,,url
1,,Super 8,,It arrives.,,2011,,PG-13,,Sci-Fi,,112,,http://www.movieposterdb.com/img/posters/11_03/2010/1650062/m_1650062_47ad90ac.jpg
2,,The Secret Life of Walter Mitty,,Stop dreaming. Start living.,,2013,,PG,,Adventure,,114,,http://www.movieposterdb.com/img/posters/13_11/2013/359950/m_359950_231f5ec8.jpg
3,,Into the Wild,,Into the heart Into the soul,,2007,,R,,Adventure,,148,,http://www.movieposterdb.com/img/posters/08_03/2007/758758/m_758758_cf9ee8b4.jpg
4,,Star Wars: The Force Awakens,,Every generation has a story.,,2015,,PG-13,,Action,,138,,http://www.movieposterdb.com/img/posters/15_11/2015/2488496/m_2488496_0dedc25d.jpg
5,,The Goonies,,The pirates map, The villainous crooks, The underground caverns, The booby traps, the skeletons, The monster, the lost treasure, and the magic that is... THE GOONIES,,1985,,PG,,Adventure,,114,,http://www.movieposterdb.com/img/posters/05_09/1985/0089218/m_51014_0089218_1e6b1771.jpg